1117,BAHIA DE MATANCHEN,21.54299,-105.276346,18,0,104,"San Blas, NAY",No hay Infromación del destino,0000-00-00 00:00:000,0000-00-00 00:00:000,1,3,,1
1118,SAYULITA FISH TACO,20.868624,-105.440418,18,0,97,"Jose Mariscal Sayulita, Nayarit",No hay Infromación del destino,0000-00-00 00:00:000,0000-00-00 00:00:000,1,3,,1
1119,SURF ,20.872586,-105.452102,18,0,120,"Sayulita Surf Camps  63732 Sayulita, Nayarit ‎  01 329 291 3350  ",No hay Infromación del destino,0000-00-00 00:00:000,0000-00-00 00:00:000,1,3,,1
1120,AHUACATLAN ,21.054425,-104.484451,18,0,101,"Ahuacatlan, NAY ",No hay Infromación del destino,0000-00-00 00:00:000,0000-00-00 00:00:000,1,3,,1
1121,SAN BLAS ,21.542511,-105.278082,18,0,101,"San Blas, NAY",No hay Infromación del destino,0000-00-00 00:00:000,0000-00-00 00:00:000,1,3,,1
1122,TEPIC HISTORICO ,21.503866,-104.895113,18,0,101,"Tepic, NAY ",No hay Infromación del destino,0000-00-00 00:00:000,0000-00-00 00:00:000,1,3,,1
1123,JALA,21.10444,-104.437937,18,0,101,"Jala, Nayarit",No hay Infromación del destino,0000-00-00 00:00:000,0000-00-00 00:00:000,1,3,,1
1124,EL NAYAR,21.884279,-104.752606,18,0,101,"EL NAYAR, NAY",No hay Infromación del destino,0000-00-00 00:00:000,0000-00-00 00:00:000,1,3,,1
1125,NOVILLERO ,22.374206,-105.673769,18,0,118,"Novillero, Nayarit",No hay Infromación del destino,0000-00-00 00:00:000,0000-00-00 00:00:000,1,3,,1
1126,PUNTA MITA,20.773569,-105.516822,18,0,104,"Punta de Mita, NAY",No hay Infromación del destino,0000-00-00 00:00:000,0000-00-00 00:00:000,1,3,,1
1127,SEMANA SANTA CORA ,21.502409,-104.918107,18,0,95,"Cora, NAY",No hay Infromación del destino,0000-00-00 00:00:000,0000-00-00 00:00:000,1,3,,1
1128,ARTE ACTUAL MEXICANO ,25.683613,-100.318593,19,0,102,"Centro Monterrey, NL, Mexico ",No hay Infromación del destino,0000-00-00 00:00:000,0000-00-00 00:00:000,1,3,,1
1129,ARTESANIAS DE MONTERREY ,25.683613,-100.318593,19,0,114,"Centro Monterrey, NL, Mexico ",No hay Infromación del destino,0000-00-00 00:00:000,0000-00-00 00:00:000,1,3,,1
1130,CALLEJON CULTURAL ,25.664863,-100.306915,19,0,102,"Francisco Javier Mina 1140 (Padre Raymundo Jardon) Monterrey, Nuevo Leon 64000",No hay Infromación del destino,0000-00-00 00:00:000,0000-00-00 00:00:000,1,3,,1
1131,CASA ROSA MUSEO DE ARTE POPULAR,25.675355,-100.318376,19,0,68,"Entre Mina y Cuauhtemoc, Centro, Garcia, NL",No hay Infromación del destino,0000-00-00 00:00:000,0000-00-00 00:00:000,1,3,,1
1132,CENTRO DE LAS ARTES,25.67727,-100.284075,19,0,8,"Centro de las artes  Centro, Monterrey, Nuevo Leon ‎ ",No hay Infromación del destino,0000-00-00 00:00:000,0000-00-00 00:00:000,1,3,,1
1133,CIENEGUILLA,25.379238,-100.15088,19,0,97,"Cieneguilla, Santiago, NL ‎ ",No hay Infromación del destino,0000-00-00 00:00:000,0000-00-00 00:00:000,1,3,,1
1134,FESTIVAL BELLA VIA,23.970548,-99.771162,19,0,95,"Zaragoza y Constitucion, Centro, General Zaragosa, NL",No hay Infromación del destino,0000-00-00 00:00:000,0000-00-00 00:00:000,1,3,,1
1135,LOS CAVAZOS,25.444592,-100.160651,19,0,118,"LOS CAVAZOS, Santiago, NL",No hay Infromación del destino,0000-00-00 00:00:000,0000-00-00 00:00:000,1,3,,1
1136,MUSEO DE ARTE CONTEMPORANEO,25.665163,-100.310029,19,0,68,"Zuazua S/N, Centro, 64000 Monterrey, Nuevo Leon ‎  01 81 8262 4500   ‎",No hay Infromación del destino,0000-00-00 00:00:000,0000-00-00 00:00:000,1,3,,1
1137,MUSEO DE ARTE CONTEMPORANEO DE MONTERREY ,25.665163,-100.310029,19,0,68,"Zuazua S/N, Centro, 64000 Monterrey, Nuevo Leon ‎  01 81 8262 4500   ‎",No hay Infromación del destino,0000-00-00 00:00:000,0000-00-00 00:00:000,1,3,,1
1138,MUSEO DEL VIDRIO ,25.686939,-100.307089,19,0,68,"Magallanes 517, 64570 Monterrey, Nuevo Leon ‎ Tel: 01 81 8863 1052   ‎  ·",No hay Infromación del destino,0000-00-00 00:00:000,0000-00-00 00:00:000,1,3,,1
1139,PINACOTECA DE NUEVO LEON ,25.67727,-100.342354,19,0,102,"Washington N/A, 64000 Monterrey, Nuevo Leon ‎ Tel: 01 81 8479 0010   ‎  ",No hay Infromación del destino,0000-00-00 00:00:000,0000-00-00 00:00:000,1,3,,1
1140,CALLEJON DE LA BOCA,25.415292,-100.141031,19,0,2,"Carretera Nacional Kilometro 247.5, San Javier, 67322 Santiago, Nuevo Leon ‎ Tel: 01 81 2285 5885   ‎ ",No hay Infromación del destino,0000-00-00 00:00:000,0000-00-00 00:00:000,1,3,,1
1141,CARNE CABRITO Y QUESO ,25.683613,-100.318593,19,0,2,"Centro Monterrey, NL, Mexico ",No hay Infromación del destino,0000-00-00 00:00:000,0000-00-00 00:00:000,1,3,,1
1142,EL CALLEJON DE SANTIAGO,25.42785,-100.152722,19,0,2,"Juarez de Santiago 400 Villa de Santiago, NL",No hay Infromación del destino,0000-00-00 00:00:000,0000-00-00 00:00:000,1,3,,1
1143,EL REY DEL CABRITO ,25.665047,-100.308032,19,0,2,"Av Constitucion 817 Oriente, Centro, 64000 Monterrey, Nuevo Leon ‎ Tel: 01 81 8345 3352  ",No hay Infromación del destino,0000-00-00 00:00:000,0000-00-00 00:00:000,1,3,,1
1144,EL RUSTICO ,25.416687,-100.159185,19,0,2,"Santiago, Nuevo Leon",No hay Infromación del destino,0000-00-00 00:00:000,0000-00-00 00:00:000,1,3,,1
1145,FERIA DE MACHACADO ,25.955498,-100.163826,19,0,1,"Centro de Cienega de Flores, 65550 Cienega de Flores, NL",No hay Infromación del destino,0000-00-00 00:00:000,0000-00-00 00:00:000,1,3,,1
1146,GARCIA,25.817818,-100.584064,19,0,2,Garcia NL,No hay Infromación del destino,0000-00-00 00:00:000,0000-00-00 00:00:000,1,3,,1
1147,LA CASA DE MAMA GRANDE ,25.016162,-100.074899,19,0,2,"A Rayones NL, Mexic",No hay Infromación del destino,0000-00-00 00:00:000,0000-00-00 00:00:000,1,3,,1
1148,LA DIVINA ,25.671081,-100.328893,19,0,2,"Centro, Monterrey, NL",No hay Infromación del destino,0000-00-00 00:00:000,0000-00-00 00:00:000,1,3,,1
1149,LAS PALOMAS ,25.424449,-100.152114,19,0,2,"Abasolo #101, 67300 Villa De Santiago, Nuevo Leon, Mexico",No hay Infromación del destino,0000-00-00 00:00:000,0000-00-00 00:00:000,1,3,,1
1150,LOS CABRITEROS,25.667967,-100.320521,19,0,2,"Av Pino Suarez Sur 900, 64720 Monterrey, Nuevo Leon ‎ Tel: 01 81 1522 0710   ‎ ",No hay Infromación del destino,0000-00-00 00:00:000,0000-00-00 00:00:000,1,3,,1
1151,BOCA DE PORTERILLOS ,26.04753,-100.637711,19,0,111,BOCA DE PORTERILLOS NL,No hay Infromación del destino,0000-00-00 00:00:000,0000-00-00 00:00:000,1,3,,1
1152,MIRADOR CUEVA DE LOS MURCIELAGOS,25.41847,100.15903,19,0,97,"Santiago, NL",No hay Infromación del destino,0000-00-00 00:00:000,0000-00-00 00:00:000,1,3,,1
1153,PARQUE NATURAL LA ENCANTADA,23.905123,-99.796051,19,0,97,"Frente A La Cancha De Basquetbol N/A, 67960 Gral. Zaragoza, Nuevo Leon ‎",No hay Infromación del destino,0000-00-00 00:00:000,0000-00-00 00:00:000,1,3,,1
1154,POZO DEL GAVILAN ,24.816186,-100.132273,19,0,97,"POZO DEL GAVILAN , NL",No hay Infromación del destino,0000-00-00 00:00:000,0000-00-00 00:00:000,1,3,,1
1155,BIOPARQUE ESTRELLA ,25.125548,-99.917935,19,0,97,"Bioparque Estrella, Monterrey NL",No hay Infromación del destino,0000-00-00 00:00:000,0000-00-00 00:00:000,1,3,,1
1156,BOSQUE MAGICO ,25.663964,-100.25216,19,0,97,"Av Eloy Cavazos s/n, La Pastora, 67178 Guadalupe, Nuevo Leon ‎ 01 81 8299 2462   ‎ ",No hay Infromación del destino,0000-00-00 00:00:000,0000-00-00 00:00:000,1,3,,1
1157,DAS BIERHAUS ,25.689491,-100.258683,19,0,12,"Av. MIguel Aleman 4329, Linda Vista, 67130 Guadalupe, Nuevo Leon ‎  Tel: 01 81 8334 8060",No hay Infromación del destino,0000-00-00 00:00:000,0000-00-00 00:00:000,1,3,,1
1158,FERIA AGRICOLA COMERCIAL Y GANADERA ,25.676187,-100.308151,19,0,95,"Monterrey, NL",No hay Infromación del destino,0000-00-00 00:00:000,0000-00-00 00:00:000,1,3,,1
1159,FERIA DE VILLASECA ,24.860428,-99.566545,19,0,95,"Linares, NL",No hay Infromación del destino,0000-00-00 00:00:000,0000-00-00 00:00:000,1,3,,1
1160,GRAN PARQUE GUADALUPE,25.676617,-100.23513,19,0,97,"ToltecaGuadalupe, Nuevo Leon",No hay Infromación del destino,0000-00-00 00:00:000,0000-00-00 00:00:000,1,3,,1
1161,MONTERREY ,25.677424,-100.309515,19,0,101,"Monterrey, NL",No hay Infromación del destino,0000-00-00 00:00:000,0000-00-00 00:00:000,1,3,,1
1162,PARQUE ACUATICO DEPORTIVO SAN BENITO,25.636115,-100.155273,19,0,106,"Carretera a San Roque Km. 2.5  Monterrey, NL",No hay Infromación del destino,0000-00-00 00:00:000,0000-00-00 00:00:000,1,3,,1
1163,PARQUE BICENTENARIO ALLENDE ,25.28535,-100.006274,19,0,71,"Felicitos Rodriguez SN-S POSADA HOGAR SAN PEDRO Independencia Puerto, 67350 Allende, NL ‎  448 ",No hay Infromación del destino,0000-00-00 00:00:000,0000-00-00 00:00:000,1,3,,1
1164,PARQUE ZOOLOGICO LA PASTORA ,25.669998,-100.249091,19,0,94,"Eloy Cavazos, Sin Nombre de Colonia 33, Guadalupe, Nuevo Leon ‎  Tel: 01 81 8337 4340   ‎ ",No hay Infromación del destino,0000-00-00 00:00:000,0000-00-00 00:00:000,1,3,,1
1165,PISTA DE HIELO MABE FUNDIDORA,25.676641,-100.280008,19,0,119,"Edificio motores No. 46 Parque fundidora, 64000 Monterrey",No hay Infromación del destino,0000-00-00 00:00:000,0000-00-00 00:00:000,1,3,,1
1166,CAMPAMENTO LA NUTRIA ,25.01624,-100.074177,19,0,18,"Carretera a Rayones km. 40, Citrus Area, Rayones, N.L.",No hay Infromación del destino,0000-00-00 00:00:000,0000-00-00 00:00:000,1,3,,1
1167,CAÑON DE POTRERO CHICO ,25.955392,-100.478008,19,0,97,"Potrero Chico Hidalgo, NL ‎",No hay Infromación del destino,0000-00-00 00:00:000,0000-00-00 00:00:000,1,3,,1
1168,CAÑONES DEL SALTO LABERINTO ,25.380401,-100.239007,19,0,97,"Cienega de Gonzalez, NL",No hay Infromación del destino,0000-00-00 00:00:000,0000-00-00 00:00:000,1,3,,1
1169,CASCADA COLA DE CABALLO,25.362409,-100.163483,19,0,97,"Parque Nacional Cumbres de Monterrey, Cieneguilla, Santiago, Nuevo Leon ",No hay Infromación del destino,0000-00-00 00:00:000,0000-00-00 00:00:000,1,3,,1
1170,EL LANTRISCAL ,24.728863,-99.907658,19,0,104,"Madero 3067830 Iturbide, Nuevo Leon",No hay Infromación del destino,0000-00-00 00:00:000,0000-00-00 00:00:000,1,3,,1
1171,GRUTAS DE GARCIA,25.860459,-100.527869,19,0,104,"Grutas de Garcia , Garcia, Nuevo Leon ‎ Tel01 81 8283 1722   D114",No hay Infromación del destino,0000-00-00 00:00:000,0000-00-00 00:00:000,1,3,,1
1172,MIRADOR CUEVA DE LOS MURCIELAGOS ECOLOGICO,25.416726,-100.159056,19,0,97,"Santiago, NL",No hay Infromación del destino,0000-00-00 00:00:000,0000-00-00 00:00:000,1,3,,1
1173,PARQUE ECOLOGICO CHIPINQUE ,25.617924,-100.359349,19,0,97,"Parque Ecologico Chipinque Carretera a Chipinque Km. 2.5, Valle de San Angel, 66261 San Pedro Garza Garcia, Nuevo Leon ‎ ",No hay Infromación del destino,0000-00-00 00:00:000,0000-00-00 00:00:000,1,3,,1
1174,PARQUE LA ESTANZUELA ,25.538569,-100.274476,19,0,71,"Al Parque Nacional Estanzuela, Sin Nombre de Colonia 64, Monterrey, Nuevo Leon ‎ ",No hay Infromación del destino,0000-00-00 00:00:000,0000-00-00 00:00:000,1,3,,1
1175,PARQUE NACIONAL CUMBRES DE MONTERREY ,25.438314,-100.311108,19,0,97,"Parque Nacional Cumbres de Monterrey Santiago, Nuevo Leon 01 81 8191 0664   ",No hay Infromación del destino,0000-00-00 00:00:000,0000-00-00 00:00:000,1,3,,1
1176,PARQUE NATURAL LA ENCANTADA ECOLOGICO,23.905096,-99.796055,19,0,97,"Frente A La Cancha De Basquetbol N/A, 67960 Gral. Zaragoza, Nuevo Leon ‎",No hay Infromación del destino,0000-00-00 00:00:000,0000-00-00 00:00:000,1,3,,1
1177,PARQUE RECREATIVO EL SALTO ,25.421726,-100.133885,19,0,97,Presa Rodrigo Gomez Nuevo Leon ‎  ,No hay Infromación del destino,0000-00-00 00:00:000,0000-00-00 00:00:000,1,3,,1
1178,PRESA LA BOCA,25.422191,-100.133958,19,0,97,"Santiago, NL",No hay Infromación del destino,0000-00-00 00:00:000,0000-00-00 00:00:000,1,3,,1
1179,CAÑON DE LA HUASTECA ,25.441259,-100.305033,19,0,97,Ave. Morones Prieto al finalizar en Sta. Catarina. N L,No hay Infromación del destino,0000-00-00 00:00:000,0000-00-00 00:00:000,1,3,,1
1180,CAÑON DE MATACANES ,25.154877,-100.094205,19,0,97,"Cañon de Adjuntas, Monterrey, Nuevo Leon ",No hay Infromación del destino,0000-00-00 00:00:000,0000-00-00 00:00:000,1,3,,1
1181,CAÑON DE POTRERO CHICO ECOLOGICO ,25.951253,-100.477208,19,0,97,"Hidalgo, Nuevo Leon",No hay Infromación del destino,0000-00-00 00:00:000,0000-00-00 00:00:000,1,3,,1
1182,CAÑON DE SAN CRISTOBAL ,25.380401,-100.239186,19,0,97,"Cienega de Gonzalez, Sierra de Santiago, Nuevo Leon, Mexico ",No hay Infromación del destino,0000-00-00 00:00:000,0000-00-00 00:00:000,1,3,,1
1183,CASCADA DEL CHIPITIN ,25.263016,-100.152452,19,0,97,"Mexico, Santiago, Nuevo Leon ‎  Tel: 01 81 8376 7623   ‎ ",No hay Infromación del destino,0000-00-00 00:00:000,0000-00-00 00:00:000,1,3,,1
1184,CUEVA DEL GAVILAN ,25.663268,-100.297894,19,0,97,"Aventureros Extremos en Serio, Paricutin 426, Nuevo Repueblo, 64000 Monterrey, Nuevo Leon ‎ Tel: 01 81 8372 5555  ",No hay Infromación del destino,0000-00-00 00:00:000,0000-00-00 00:00:000,1,3,,1
1185,EL LABERINTO ,25.718841,-100.283271,19,0,97,"El Laberinto Nogalar 307, Industrial Nogalar, 66484 San Nicolas de Los Garza, Nuevo Leon ‎ 01 81 8353 2274   ‎ ",No hay Infromación del destino,0000-00-00 00:00:000,0000-00-00 00:00:000,1,3,,1
1186,EL SALTO ,23.962097,-99.768576,19,0,97,"El Salto, General Zaragoza",No hay Infromación del destino,0000-00-00 00:00:000,0000-00-00 00:00:000,1,3,,1
1187,GRUTAS DE BUSTAMANTE ,25.847792,-100.511911,19,0,97,Parque Gutas de Garcia Nuevo Leon  ,No hay Infromación del destino,0000-00-00 00:00:000,0000-00-00 00:00:000,1,3,,1
1188,HIDROFOBIA ,25.32789,-100.162024,19,0,120,"Potrero Redondo, Santiago, Nuevo Leon, Mexico",No hay Infromación del destino,0000-00-00 00:00:000,0000-00-00 00:00:000,1,3,,1
1189,LA TIERROSA,25.32789,-100.162024,19,0,97,"Potrero Redondo, Santiago, Nuevo Leon, Mexico",No hay Infromación del destino,0000-00-00 00:00:000,0000-00-00 00:00:000,1,3,,1
1190,NIDO DE LOS AGUILUCHOS,25.648954,-100.458154,19,0,97,"Huasteca - Vecinal, 22, Santa Catarina, Nuevo Leon ",No hay Infromación del destino,0000-00-00 00:00:000,0000-00-00 00:00:000,1,3,,1
1191,PARQUE NACIONAL CUMBRE DE MONTERREY EXTREMO ,25.441414,-100.305231,19,0,97,"Parque Nacional Cumbres de Monterrey Santiago, Nuevo Leon ",No hay Infromación del destino,0000-00-00 00:00:000,0000-00-00 00:00:000,1,3,,1
1192,POZO DEL GAVILAN ,24.816167,-100.132252,19,0,97,Pozo del Gavilan Nuevo Leon ‎ ,No hay Infromación del destino,0000-00-00 00:00:000,0000-00-00 00:00:000,1,3,,1
1193,VIA FERRATA,25.648954,-100.458154,19,0,120,"Huasteca - Vecinal, 22, Santa Catarina, Nuevo Leon ",No hay Infromación del destino,0000-00-00 00:00:000,0000-00-00 00:00:000,1,3,,1
1194,BOCA DE POTRERILLOS,26.047684,-100.637698,19,0,111,"Boca de Potrerillos, NL",No hay Infromación del destino,0000-00-00 00:00:000,0000-00-00 00:00:000,1,3,,1
1195,CATEDRAL METROPOLITANA ,25.665975,-100.310353,19,0,25,"Macroplaza 5 de Mayo, Zaragoza, Zuazua y Constitucion, Centro, 64000 Monterrey, NL ",No hay Infromación del destino,0000-00-00 00:00:000,0000-00-00 00:00:000,1,3,,1
1196,EXPLANADA DE LOS HEROES ,25.672512,-100.311252,19,0,99,"Explanada de Los Heroes Centro, 64000 Monterrey, NL ‎",No hay Infromación del destino,0000-00-00 00:00:000,0000-00-00 00:00:000,1,3,,1
1197,MACROPLAZA ,25.67023,-100.3102,19,0,115,"Ignacio Zaragoza Centro, 64000 Monterrey, NL ",No hay Infromación del destino,0000-00-00 00:00:000,0000-00-00 00:00:000,1,3,,1
1198,MUSEO DE AUTOS Y TRANSPORTE DE MONTERREY,25.714394,-100.311726,19,0,68,"Alfonso Reyes SN, Parque Niños Heroes, 64000 Monterrey, Nuevo Leon ‎ 01 81 8331 3890   ‎ ",No hay Infromación del destino,0000-00-00 00:00:000,0000-00-00 00:00:000,1,3,,1
1199,MUSEO DE HISTORIA MUNICIPAL DE ALLENDE,25.280305,-100.017475,19,0,68,"Allende y Bravo s/n Col. Centro, Allende, N.L., C.P. 67350",No hay Infromación del destino,0000-00-00 00:00:000,0000-00-00 00:00:000,1,3,,1
1200,MUSEO DE ACERO HORNO 3,25.676187,-100.282395,19,0,68,"Av Fundidora y Adolfo Prieto S/N, Obrera, 64010 Monterrey, NL ‎Tel: 01 81 8126 1100",No hay Infromación del destino,0000-00-00 00:00:000,0000-00-00 00:00:000,1,3,,1
1201,MUSEO DEL NORESTE MUNE ,25.670801,-100.306701,19,0,68,"Dr. Jose Ma. Coss 445, Centro, Monterrey, Nuevo Leon ‎  Tel: 01 81 2033 9898",No hay Infromación del destino,0000-00-00 00:00:000,0000-00-00 00:00:000,1,3,,1
1202,PARQUE FUNDIDORA,25.678817,-100.28145,19,0,71,"Avenida Fundidora y Adolfo Prieto S/N, Obrera, 64010 Monterrey, NL Tel: 01 81 8126 8500",No hay Infromación del destino,0000-00-00 00:00:000,0000-00-00 00:00:000,1,3,,1
1203,SANTIAGO,25.679977,-100.316255,19,0,101,"Santiago Tapia 337 Centro, 64000 Monterrey, NL ",No hay Infromación del destino,0000-00-00 00:00:000,0000-00-00 00:00:000,1,3,,1
1204,BOCA DE POTRERILLOS ,26.047607,-100.637783,19,0,111,"Boca de Potrerillos, NL ",No hay Infromación del destino,0000-00-00 00:00:000,0000-00-00 00:00:000,1,3,,1
1205,CAÑON DE LA HUASTECA ,25.576666,-100.418843,19,0,97,Parque Nacional Cumbres de Monterrey,No hay Infromación del destino,0000-00-00 00:00:000,0000-00-00 00:00:000,1,3,,1
1206,PARQUE FUNDIDORA SORPRENDENTE ,25.678817,-100.28145,19,0,71,"Avenida Fundidora y Adolfo Prieto S/N, Obrera, 64010 Monterrey, NL Tel: 01 81 8126 8500",No hay Infromación del destino,0000-00-00 00:00:000,0000-00-00 00:00:000,1,3,,1
1207,POZO DEL GAVILAN ,24.816186,-100.132295,19,0,97,"POZO DEL GAVILAN , NL",No hay Infromación del destino,0000-00-00 00:00:000,0000-00-00 00:00:000,1,3,,1
1208,"ALEBRIJES, BARRO NEGRO, MOLE Y QUESILLO",17.038732,-96.789407,20,0,1,Mercado Artesanal Alebrijes  Oaxaca ‎ ,No hay Infromación del destino,0000-00-00 00:00:000,0000-00-00 00:00:000,1,3,,1
1209,ALFARERIA ,17.038732,-96.789407,20,0,1,Mercado Artesanal Alebrijes  Oaxaca ‎ ,No hay Infromación del destino,0000-00-00 00:00:000,0000-00-00 00:00:000,1,3,,1
1210,BARRO NEGRO ,17.060805,-96.728829,20,0,1,"Trujano 321, colonia centro, 68000 Oaxaca ‎  01 951 516 2005",No hay Infromación del destino,0000-00-00 00:00:000,0000-00-00 00:00:000,1,3,,1
1211,CENTRO CULTURAL SANTO DOMINGO Y  JARDIN ETNOBOTANICO,17.065493,-96.721961,20,0,102,"Jardin Etnobotanico de Oaxaca Centro Cultural Santo Domingo Reforma s/n esquina Constitucion A.P. 367 Centro, Oaxaca, Oax. C.P. 68000. Correo Electronico",No hay Infromación del destino,0000-00-00 00:00:000,0000-00-00 00:00:000,1,3,,1
1212,CERAMICA,17.064005,-96.725191,20,0,1,"Matamoros 105 RUTA INDEPENDENCIA, Oaxaca Centro, 68000 Oaxaca ‎  Tel: 01 951 516 5062 ",No hay Infromación del destino,0000-00-00 00:00:000,0000-00-00 00:00:000,1,3,,1
1213,CESTERIA,17.064005,-96.725191,20,0,1,"Matamoros 105 RUTA INDEPENDENCIA, Oaxaca Centro, 68000 Oaxaca ‎  Tel: 01 951 516 5062 ",No hay Infromación del destino,0000-00-00 00:00:000,0000-00-00 00:00:000,1,3,,1
1214,EL INSTITUTO DE ARTES GRAFICAS DE OAXACA,17.066408,-96.723859,20,0,81,"Juarez 222, RUTA INDEPENDENCIA, Oaxaca ‎  01 951 516 6980  ",No hay Infromación del destino,0000-00-00 00:00:000,0000-00-00 00:00:000,1,3,,1
1215,MERCADO DE CUCHITAN,16.4858,-95.040062,20,0,114,"Avenida 16 de Septiembre 19, Centro, 70000 Juchitán de Zaragoza, Oaxaca ‎  Tel: 01 971 711 1507   ‎ ",No hay Infromación del destino,0000-00-00 00:00:000,0000-00-00 00:00:000,1,3,,1
1216,MUSEO DE ARTE CONTEMPORANEO DE OAXACA,17.063016,-96.724298,20,0,68,"200, Centro, 68000 Oaxaca, OAX ‎  ",No hay Infromación del destino,0000-00-00 00:00:000,0000-00-00 00:00:000,1,3,,1
1217,MUSEO DE ARTES POPULARES,16.958333,-96.707847,20,0,68,"Independencia S/N, 1a Seccion Barrio La Calera, 71256 San Bartolo Coyotepec, Oaxaca ‎ 01 951 551 0036  ",No hay Infromación del destino,0000-00-00 00:00:000,0000-00-00 00:00:000,1,3,,1
1218,MUSEO DE LA FILATELIA,17.066036,-96.721641,20,0,68,"Reforma 504, Centro Historico, 68000 Oaxaca ‎  Tel: 01 951 514 2375   ‎",No hay Infromación del destino,0000-00-00 00:00:000,0000-00-00 00:00:000,1,3,,1
1219,MUSEO DE LOS PITORES OAXAQUEÑOS,17.062221,-96.725696,20,0,68,"Independencia, Centro, Oaxaca ‎ Tel: 01 951 516 5645",No hay Infromación del destino,0000-00-00 00:00:000,0000-00-00 00:00:000,1,3,,1
1220,MUSEO TEXTIL DE OAXACA ,17.060805,-96.722821,20,0,68,"Hidalgo 917, Centro Historico, 68000 Oaxaca ‎ Tel: 01 951 501 1104   ‎",No hay Infromación del destino,0000-00-00 00:00:000,0000-00-00 00:00:000,1,3,,1
1221,TELARES Y MANOS,17.059739,-96.721971,20,0,1,"Oaxaca, Mexico",No hay Infromación del destino,0000-00-00 00:00:000,0000-00-00 00:00:000,1,3,,1
1222,BAHIA DE MAGUEY,15.75971,-96.123433,20,0,104,"Huatulco, Oaxaca",No hay Infromación del destino,0000-00-00 00:00:000,0000-00-00 00:00:000,1,3,,1
1223,CATEDRAL,17.061503,-96.725052,20,0,25,"Valdivieso, Centro, 68000 Oaxaca ‎ Tel: 01 951 180 4533",No hay Infromación del destino,0000-00-00 00:00:000,0000-00-00 00:00:000,1,3,,1
1224,CENTRO RECREATIVO LOS MOLINOS ,17.310655,-96.444278,20,0,120,"16 De Setiembre N/A, 68760 Capulalpam De Mendez, Oaxaca ",No hay Infromación del destino,0000-00-00 00:00:000,0000-00-00 00:00:000,1,3,,1
1225,FESTIVAL DE MOLE DE CADERAS ,17.068846,-96.720213,20,0,1,"Av Juarez 703, Centro, 68000 Oaxaca ‎  Tel: 01 951 516 0123",No hay Infromación del destino,0000-00-00 00:00:000,0000-00-00 00:00:000,1,3,,1
1226,FINCAS CAFETALERAS ,17.040493,-96.728681,20,0,1,"Av. Oaxaca, MZa.12, Lote #3, 70987 Santa Cruz Huatulco, Oaxaca ‎  Tel: 01 958 587 1515",No hay Infromación del destino,0000-00-00 00:00:000,0000-00-00 00:00:000,1,3,,1
1227,HUATULCO ,15.834536,-96.323071,20,0,104,"Santa Maria Huatulco, Oaxaca ",No hay Infromación del destino,0000-00-00 00:00:000,0000-00-00 00:00:000,1,3,,1
1228,MERCADO 20 DE NOVIEMBRE ,17.043245,-96.714499,20,0,113,"20 de Noviembre, Centro, Oaxaca ‎  Tel: 01 951 511 0992   ‎ ",No hay Infromación del destino,0000-00-00 00:00:000,0000-00-00 00:00:000,1,3,,1
1229,MERCADO DE JUCHITAN ,16.433348,-95.016678,20,0,114,"Juchitan de Zaragoza, Oaxaca",No hay Infromación del destino,0000-00-00 00:00:000,0000-00-00 00:00:000,1,3,,1
1230,TIANGUIS DE TLACOLULA,17.70462,-96.789343,20,0,114,"Tlacolula, Oaxaca",No hay Infromación del destino,0000-00-00 00:00:000,0000-00-00 00:00:000,1,3,,1
1231,BAHIA DE CHAHUE,15.759462,-96.12516,20,0,104,"Boulevard Chahue P Chahue, 70987 Crucecita, OAX ‎",No hay Infromación del destino,0000-00-00 00:00:000,0000-00-00 00:00:000,1,3,,1
1232,BAHIA DE TANGOLUNDA,15.75971,-96.123433,20,0,104,"Huatulco, Oaxaca",No hay Infromación del destino,0000-00-00 00:00:000,0000-00-00 00:00:000,1,3,,1
1233,EL ADOQUIN ,15.865581,-97.069537,20,0,116,"Puerto Escondido, OAX ",No hay Infromación del destino,0000-00-00 00:00:000,0000-00-00 00:00:000,1,3,,1
1234,HUATULCO DIVERTIDO,15.834536,-96.323071,20,0,104,"Santa Maria Huatulco, Oaxaca ",No hay Infromación del destino,0000-00-00 00:00:000,0000-00-00 00:00:000,1,3,,1
1235,LA PUNTA ,19.094078,-104.351542,20,0,104,"Manzanillo, Oaxaca",No hay Infromación del destino,0000-00-00 00:00:000,0000-00-00 00:00:000,1,3,,1
1236,PLAYA CARRIZALILLO,15.859843,-97.080477,20,0,104,"Carrizalillo Puerto Escondido, OAX ‎ ",No hay Infromación del destino,0000-00-00 00:00:000,0000-00-00 00:00:000,1,3,,1
1237,PLAYAS MANZANILLO,19.056439,-104.30696,20,0,104,"Manzanillo, Oaxaca",No hay Infromación del destino,0000-00-00 00:00:000,0000-00-00 00:00:000,1,3,,1
1238,PUERO ANGEL ,15.666718,-96.490524,20,0,104,"Puerto angel, OAX ",No hay Infromación del destino,0000-00-00 00:00:000,0000-00-00 00:00:000,1,3,,1
1239,PLAYA ANGELITO ,15.857345,-97.074255,20,0,104,"Puerto Angelito, Oaxaca",No hay Infromación del destino,0000-00-00 00:00:000,0000-00-00 00:00:000,1,3,,1
1240,PUERTO ESCONDIDO ,15.865746,-97.069409,20,0,104,"Puerto Escondido, OAX ",No hay Infromación del destino,0000-00-00 00:00:000,0000-00-00 00:00:000,1,3,,1
1241,SANTA CRUZ,17.076969,-96.737222,20,0,104,"Cristobal Colon 602, Centro, 68000 Oaxaca ‎ Tel: 01 951 516 2393   ‎ ",No hay Infromación del destino,0000-00-00 00:00:000,0000-00-00 00:00:000,1,3,,1
1242,BAHIA DE CALCUTA ,15.75971,-96.123433,20,0,104,"Huatulco, Oaxaca",No hay Infromación del destino,0000-00-00 00:00:000,0000-00-00 00:00:000,1,3,,1
1243,BAHIA DE LOS CONEJOS ,15.75971,-96.123433,20,0,104,"Huatulco, Oaxaca",No hay Infromación del destino,0000-00-00 00:00:000,0000-00-00 00:00:000,1,3,,1
1244,BAHIA DE CALCUTA Y SAN AGUSTIN,16.417644,-96.966815,20,0,104,"San Agustin, OAX ",No hay Infromación del destino,0000-00-00 00:00:000,0000-00-00 00:00:000,1,3,,1
1245,BAHIAS DE ORGANO Y MAGUEY ,15.75971,-96.123433,20,0,104,"Huatulco, Oaxaca",No hay Infromación del destino,0000-00-00 00:00:000,0000-00-00 00:00:000,1,3,,1
1246,BENITO JUAREZ,17.077051,-96.735738,20,0,97,"Benito Juarez, Oaxaca, OAX ‎ ",No hay Infromación del destino,0000-00-00 00:00:000,0000-00-00 00:00:000,1,3,,1
1247,ESCOBILLA,15.748971,-96.467263,20,0,104,"San Pedro Pochutla, Oax",No hay Infromación del destino,0000-00-00 00:00:000,0000-00-00 00:00:000,1,3,,1
1248,FINCAS CAFETALERAS ECOLOGICO,18.087117,-96.126471,20,0,1,"Tuxtepec, Oaxaca",No hay Infromación del destino,0000-00-00 00:00:000,0000-00-00 00:00:000,1,3,,1
1249,HIERVE EL AGUA ,16.868948,-96.27811,20,0,98,"Hierve el Agua, Oaxaca",No hay Infromación del destino,0000-00-00 00:00:000,0000-00-00 00:00:000,1,3,,1
1250,HUATULCO ,15.834536,-96.323071,20,0,104,"Santa Maria Huatulco, Oaxaca ",No hay Infromación del destino,0000-00-00 00:00:000,0000-00-00 00:00:000,1,3,,1
1251,IXTLAN DE JUAREZ,17.332327,-96.487219,20,0,118,"Ixtlan de Juarez, OAX ",No hay Infromación del destino,0000-00-00 00:00:000,0000-00-00 00:00:000,1,3,,1
1252,PLAYA LA ENTREGA ,15.743726,-96.128962,20,0,104,"Playa la entrega, Huatulco, Oaxaca ‎ ",No hay Infromación del destino,0000-00-00 00:00:000,0000-00-00 00:00:000,1,3,,1
1253,LA NEVERIA ,17.065423,-96.728657,20,0,97,"Hidalgo No. 1  La Neveria, Oaxaca, Oficina de Expediciones Sierra Norte en la Ciudad de Oaxaca: M. Bravo, 210-i Plaza San Cristobal, Centro Historico",No hay Infromación del destino,0000-00-00 00:00:000,0000-00-00 00:00:000,1,3,,1
1254,LA VAINILLA ,15.746731,-96.546298,20,0,97,"Santa Maria Tonameca, Oaxaca",No hay Infromación del destino,0000-00-00 00:00:000,0000-00-00 00:00:000,1,3,,1
1255,LAGUNA DE MANIALTEPEC ,15.75971,-96.123433,20,0,97,"Huatulco, Oaxaca",No hay Infromación del destino,0000-00-00 00:00:000,0000-00-00 00:00:000,1,3,,1
