2140,CALCEHTOK,20.566481,-89.91207,31,0,111,"Calcehtok, YUC ",No hay Infromación del destino,0000-00-00 00:00:000,0000-00-00 00:00:000,1,3,,1
2141,CENOTE IK KIL,20.66194,-88.549726,31,0,97,"Ik Kil, Yucatan ",No hay Infromación del destino,0000-00-00 00:00:000,0000-00-00 00:00:000,1,3,,1
2142,CENOTES BOLONCHOOJOL CHACZINICCHE CHELENTUN SORPRENDENTE ,20.712968,-89.327198,31,0,97,"Chiunkanan, Yucatan",No hay Infromación del destino,0000-00-00 00:00:000,0000-00-00 00:00:000,1,3,,1
2143,CHICHEN ITZA SORPRENDENTE ,20.682628,-88.568651,31,0,111,"Chichen-Itza, Valladolid - Merida, YUC",No hay Infromación del destino,0000-00-00 00:00:000,0000-00-00 00:00:000,1,3,,1
2144,EKNAKAN SORPRENDENTE ,20.758482,-89.371058,31,0,117,"Calle 28, YUC ",No hay Infromación del destino,0000-00-00 00:00:000,0000-00-00 00:00:000,1,3,,1
2145,LA NOCHE DE LOS MAYAS ,20.398376,-89.53567,31,0,95,Sin Definir,No hay Infromación del destino,0000-00-00 00:00:000,0000-00-00 00:00:000,1,3,,1
2146,LOLTUN ,20.254306,-89.455689,31,0,97,"Loltun, YUC",No hay Infromación del destino,0000-00-00 00:00:000,0000-00-00 00:00:000,1,3,,1
2147,FESTIVAL BARROCO DEL MUSEO DE GUADALUPE ,22.773154,-102.574993,32,0,95,"Jardín Juárez 177 Zona Centro CP 98000, Guadalupe, Zacatecas Tels. (492) 923 23 86",No hay Infromación del destino,0000-00-00 00:00:000,0000-00-00 00:00:000,1,3,,1
2148,FESTIVAL CULTURAL DE ZACATECAS,22.771057,-102.583297,32,0,95,"Zacatecas, ZAC",No hay Infromación del destino,0000-00-00 00:00:000,0000-00-00 00:00:000,1,3,,1
2149,FESTIVAL DE POESIA ZACATECAS ,-102.573127,-102.573127,32,0,95," Hidalgo 501, Centro, 98000 Zacatecas ‎Tel: 01 492 922 8832",No hay Infromación del destino,0000-00-00 00:00:000,0000-00-00 00:00:000,1,3,,1
2150,FESTIVAL INTERNACIONAL DE TEATRO DE CALLE ,22.771057,-102.583297,32,0,95,"Zacatecas, ZAC",No hay Infromación del destino,0000-00-00 00:00:000,0000-00-00 00:00:000,1,3,,1
2151,FESTIVAL ZACATECAS DE FOLCLOR INTERNACIONAL,22.745077,-102.514079,32,0,95,"Guadalupe, Zacatecas",No hay Infromación del destino,0000-00-00 00:00:000,0000-00-00 00:00:000,1,3,,1
2152,MUSEO DE ARTE ABSTRACTO MANUEL FELGUEREZ,-102.572486,-102.572486,32,0,68," Colón SN, Centro, 98000 Zacatecas ‎Tel: 01 492 922 0322 ‎",No hay Infromación del destino,0000-00-00 00:00:000,0000-00-00 00:00:000,1,3,,1
2153,MUSEO GUADALUPE ,-102.565749,-102.565749,32,0,68,"Altapalmira Zacatecas, ZAC ",No hay Infromación del destino,0000-00-00 00:00:000,0000-00-00 00:00:000,1,3,,1
2154,MUSEO FRANCISCO GOITIA ,22.770187,-102.577182,32,0,68,"Enrique Estrada 102, Centro, 98050 Zacatecas ‎ Tel: 01 492 922 0211",No hay Infromación del destino,0000-00-00 00:00:000,0000-00-00 00:00:000,1,3,,1
2155,MUSEO MANUEL FELGUEREZ ,22.780804,-102.572638,32,0,68,"2a. del Seminario 1201 Centro, 98017 Zacatecas, ZAC ",No hay Infromación del destino,0000-00-00 00:00:000,0000-00-00 00:00:000,1,3,,1
2156,MUSEO RAFAEL CORONEL ,22.782117,-102.569951,32,0,68,"San Francisco S/N, Centro, 98000 Zacatecas ‎  Tel: 01 492 922 8116  ",No hay Infromación del destino,0000-00-00 00:00:000,0000-00-00 00:00:000,1,3,,1
2157,BRUJITAS,23.632602,-103.640655,32,0,2,"Genaro Codina Esq. San Francisco, Sombrerete, Zacatecas",No hay Infromación del destino,0000-00-00 00:00:000,0000-00-00 00:00:000,1,3,,1
2158,EL COYOTE,23.641556,-103.640622,32,0,2,"Carretera Panamericana Kilómetro 161, López Mateos, 99100 Sombrerete, Zacatecas ‎ ",No hay Infromación del destino,0000-00-00 00:00:000,0000-00-00 00:00:000,1,3,,1
2159,EL RECOVECO ,22.773095,-102.577139,32,0,2,"Torreon 513, Centro, Zacatecas",No hay Infromación del destino,0000-00-00 00:00:000,0000-00-00 00:00:000,1,3,,1
2160,HOJA DE ROBLE ,22.770187,-102.577182,32,0,2,Sin Definir,No hay Infromación del destino,0000-00-00 00:00:000,0000-00-00 00:00:000,1,3,,1
2161,LA CANTERA MUSICAL ,22.774653,-102.572807,32,0,2,"Tacuba 2 Centro, Zacatecas, ZAC",No hay Infromación del destino,0000-00-00 00:00:000,0000-00-00 00:00:000,1,3,,1
2162,LA GLORIA ,22.774935,-103.580457,32,0,2,"Av. De la Juventud, Lagunilla, Valparaiso, Zacatecas",No hay Infromación del destino,0000-00-00 00:00:000,0000-00-00 00:00:000,1,3,,1
2163,LOS DORADOS DE VILLA ,22.782097,-102.570935,32,0,2," Plazuela de García 1314, Centro, 98000 Zacatecas ‎Tel: 01 492 922 5722",No hay Infromación del destino,0000-00-00 00:00:000,0000-00-00 00:00:000,1,3,,1
2164,LOS JORGES,21.448915,-103.523669,32,0,2,"Libramiento Sur 10, Teul de Gonzalez Ortega, Zacatecas",No hay Infromación del destino,0000-00-00 00:00:000,0000-00-00 00:00:000,1,3,,1
2165,MUSEOS-BAR LA BARRA ,23.634676,-103.638242,32,0,2,"Jardín Zaragoza, 99100 Sombrerete, Zacatecas Tel: 01 433 935 0444",No hay Infromación del destino,0000-00-00 00:00:000,0000-00-00 00:00:000,1,3,,1
2166,TININOLE ,21.448915,-103.523669,32,0,2,"Teul de Gonzalez Ortega, Zacatecas, Mex.",No hay Infromación del destino,0000-00-00 00:00:000,0000-00-00 00:00:000,1,3,,1
2167,VILLA LLERENA ,23.632985,-103.638822,32,0,2,"Hidalgo 207, Centro, Sombrerete, Zacatecas",No hay Infromación del destino,0000-00-00 00:00:000,0000-00-00 00:00:000,1,3,,1
2168,PARQUE ECOLOGICO Y MINA TURISTICA,23.160958,-102.86744,32,0,97,"Fresnillo, Zacatecas",No hay Infromación del destino,0000-00-00 00:00:000,0000-00-00 00:00:000,1,3,,1
2169,FRESNILLO,22.297356,-101.574833,32,0,118,"Pinos, ZAC",No hay Infromación del destino,0000-00-00 00:00:000,0000-00-00 00:00:000,1,3,,1
2170,SIERRA DE CARDOS ,21.773534,-103.289332,32,0,97,"Sierra de Cardos, Morones, 99700 Tlaltenango de Sanchez Roman, ZAC ",No hay Infromación del destino,0000-00-00 00:00:000,0000-00-00 00:00:000,1,3,,1
2171,SIERRA DE ORGANOS ,23.987507,-103.821859,32,0,97,Parque Nacional Sierra de Organos,No hay Infromación del destino,0000-00-00 00:00:000,0000-00-00 00:00:000,1,3,,1
2172,CENTRO INTERACTIVO DE CIENCIAS ZIGZAG,22.761545,-102.578161,32,0,68,"De La Juventud 310 Zona A, 98070 Zacatecas, ZAC",No hay Infromación del destino,0000-00-00 00:00:000,0000-00-00 00:00:000,1,3,,1
2173,EL CHAPARRAL DISCO ,22.767491,-102.582042,32,0,12,"Heroes de Chapultepec 109, Centro, 98000 Zacatecas ‎Tel: 01 492 922 7300   ‎",No hay Infromación del destino,0000-00-00 00:00:000,0000-00-00 00:00:000,1,3,,1
2174,LA MINA CLUB,22.77677,-102.579714,32,0,12,"De La Loma 3, Caminera, 98045 Zacatecas, ZAC",No hay Infromación del destino,0000-00-00 00:00:000,0000-00-00 00:00:000,1,3,,1
2175,LAS QUINCE LETRAS,22.760679,-102.573275,32,0,12,"Calzada Reyes Heroles # 100 (Junto al Parque La Encantada Zacatecas, Zacatecas, Mexico Tel: (492) 925 3308.",No hay Infromación del destino,0000-00-00 00:00:000,0000-00-00 00:00:000,1,3,,1
2176,LIFE,22.778086,-102.575264,32,0,12,"Grillo SN, Centro, 98000 Zacatecas ",No hay Infromación del destino,0000-00-00 00:00:000,0000-00-00 00:00:000,1,3,,1
2177,MANDALAI ,22.774285,-102.572828,32,0,12,"Tacuba Local T5 Centro Historico, Zacatecas",No hay Infromación del destino,0000-00-00 00:00:000,0000-00-00 00:00:000,1,3,,1
2178,PARAISO CAXCAN,21.500951,-103.084209,32,0,106,"Juchipila-Tabasco, Achoquen, Zacatecas",No hay Infromación del destino,0000-00-00 00:00:000,0000-00-00 00:00:000,1,3,,1
2179,PASEO TAURINO ,22.362164,-102.889243,32,0,95,"Bellavista, Villanueva, Zacatecas",No hay Infromación del destino,0000-00-00 00:00:000,0000-00-00 00:00:000,1,3,,1
2180,RED LOUNGE ,22.773936,-102.574204,32,0,12,Plazuela Auza Zacatecas,No hay Infromación del destino,0000-00-00 00:00:000,0000-00-00 00:00:000,1,3,,1
2181,SANTINO ,22.764478,-102.555877,32,0,12,"Universidad 101, Zacatecas",No hay Infromación del destino,0000-00-00 00:00:000,0000-00-00 00:00:000,1,3,,1
2182,PARQUE ECOLOGICO Y MINA TURISTICA ECOLOGICO ,23.160958,-102.86744,32,0,97,"Fresnillo, Zacatecas",No hay Infromación del destino,0000-00-00 00:00:000,0000-00-00 00:00:000,1,3,,1
2183,SIERRA DE CARDOS ECOLOGICA ,22,-103.825,32,0,97,"Sierra de Cardos, Zacatecas",No hay Infromación del destino,0000-00-00 00:00:000,0000-00-00 00:00:000,1,3,,1
2184,SIERRA DE CARDOS ,22,-103.825,32,0,97,"Sierra de Cardos, Zacatecas",No hay Infromación del destino,0000-00-00 00:00:000,0000-00-00 00:00:000,1,3,,1
2185,SIERRA DE ORGANOS ECOLOGICO ,23.987507,-103.821859,32,0,97,Parque Nacional Sierra de Organos,No hay Infromación del destino,0000-00-00 00:00:000,0000-00-00 00:00:000,1,3,,1
2186,UNIDAD DE MANEJO AMBIENTAL ,22.770187,-102.577182,32,0,97,Sin Definir,No hay Infromación del destino,0000-00-00 00:00:000,0000-00-00 00:00:000,1,3,,1
2187,SIERRA DE CARDOS ,21.773534,-103.289332,32,0,97,"Sierra de Cardos, Morones, 99700 Tlaltenango de Sanchez Roman, ZAC ",No hay Infromación del destino,0000-00-00 00:00:000,0000-00-00 00:00:000,1,3,,1
2188,SIERRA DE ORGANOS ,23.987507,-103.821859,32,0,97,Parque Nacional Sierra de Organos,No hay Infromación del destino,0000-00-00 00:00:000,0000-00-00 00:00:000,1,3,,1
2189,TIROLESA 840,22.777225,-102.562518,32,0,120,"Cerro de la Bufa, Zacatecas",No hay Infromación del destino,0000-00-00 00:00:000,0000-00-00 00:00:000,1,3,,1
2190,UNIDAD DE MANEJO AMBIENTAL ,22.770187,-102.577182,32,0,97,Sin Definir,No hay Infromación del destino,0000-00-00 00:00:000,0000-00-00 00:00:000,1,3,,1
2191,ACUEDUCTO DEL CUBO ,22.769064,-102.575967,32,0,97,"Acueducto el Cubo, Gonzalez Ortega, Centro, Zacatecas ‎ ",No hay Infromación del destino,0000-00-00 00:00:000,0000-00-00 00:00:000,1,3,,1
2192,ALTAVISTA,-103.880982,-103.880982,32,0,101,"Chalchihuites, Zacatecas",No hay Infromación del destino,0000-00-00 00:00:000,0000-00-00 00:00:000,1,3,,1
2193,CAPILLA DE LA CANDELARIA ,23.634764,-103.640129,32,0,25,"Sombrete, Zacatecas, Mex. ",No hay Infromación del destino,0000-00-00 00:00:000,0000-00-00 00:00:000,1,3,,1
2194,CAPILLA DE LA SANTA VERACRUZ,23.634764,-103.640129,32,0,25,"Sombrete, Zacatecas, Mex. ",No hay Infromación del destino,0000-00-00 00:00:000,0000-00-00 00:00:000,1,3,,1
2195,CATEDRAL ,22.775657,-102.572213,32,0,25,"De Las Campañas 102, Centro, 98000 Zacatecas, ZAC ",No hay Infromación del destino,0000-00-00 00:00:000,0000-00-00 00:00:000,1,3,,1
2196,CERRO DE LA BUFA ,22.777225,-102.562518,32,0,97,"Cerro de la Bufa, Zacatecas",No hay Infromación del destino,0000-00-00 00:00:000,0000-00-00 00:00:000,1,3,,1
2197,CONVENTO DE SAN MATEO ,23.634764,-103.640129,32,0,25,"Sombrete, Zacatecas, Mex. ",No hay Infromación del destino,0000-00-00 00:00:000,0000-00-00 00:00:000,1,3,,1
2198,EL TEUL ,21.448915,-103.523669,32,0,115,"Teul de Gonzalez Ortega, Zacatecas, Mex.",No hay Infromación del destino,0000-00-00 00:00:000,0000-00-00 00:00:000,1,3,,1
2199,LA QUEMADA ,23.500207,-102.816632,32,0,111,"La Quemada, Zacatecas",No hay Infromación del destino,0000-00-00 00:00:000,0000-00-00 00:00:000,1,3,,1
2200,MERCADO GONZALES ORTEGA ,22.77539,-102.572787,32,0,113,"Mercado Gonzales Ortega, Hidalgo, Centro, Zacatecas ‎ ",No hay Infromación del destino,0000-00-00 00:00:000,0000-00-00 00:00:000,1,3,,1
2201,MUSEO DE LA TOMA DE ZACATECAS,22.778266,-102.565731,32,0,68,"Altapalmira Zacatecas, ZAC ",No hay Infromación del destino,0000-00-00 00:00:000,0000-00-00 00:00:000,1,3,,1
2202,PLAZA DE ARMAS ,22.776414,-102.571858,32,0,104,"De las Campañas, Centro, 98000 Zacatecas, ZAC ",No hay Infromación del destino,0000-00-00 00:00:000,0000-00-00 00:00:000,1,3,,1
2203,SAN AGUSTIN ,22.773842,-102.574518,32,0,25,"Miguel Auza y Callejón de San Agustín, Zona Centro",No hay Infromación del destino,0000-00-00 00:00:000,0000-00-00 00:00:000,1,3,,1
2204,SANTO DOMINGO ,23.635639,-103.636633,32,0,25,"Santo Domingo 99100 Sombrerete, ZAC ",No hay Infromación del destino,0000-00-00 00:00:000,0000-00-00 00:00:000,1,3,,1
2205,TEATRO CALDERON ,22.774816,-102.572976,32,0,96,"Centro, 98000 Zacatecas, ZAC ‎",No hay Infromación del destino,0000-00-00 00:00:000,0000-00-00 00:00:000,1,3,,1
2206,TEMPLO DE LA SOLEDAD ,23.634764,-103.640129,32,0,25,"Sombrete, Zacatecas, Mex. ",No hay Infromación del destino,0000-00-00 00:00:000,0000-00-00 00:00:000,1,3,,1
2207,TEMPLO DE SAN JUAN BAUTISTA ,22.791345,-102.560195,32,0,25,"Miguel Chavez, Las Mercedes, 98039 ZAC ",No hay Infromación del destino,0000-00-00 00:00:000,0000-00-00 00:00:000,1,3,,1
2208,ZACATECAS ,22.770968,-102.583274,32,0,101,"Zacatecas, ZAC",No hay Infromación del destino,0000-00-00 00:00:000,0000-00-00 00:00:000,1,3,,1
2209,CABALGATA TURISTICA REVOLUCIONARIA ,22.777225,-102.562518,32,0,95,"Cerro de la Bufa, Zacatecas",No hay Infromación del destino,0000-00-00 00:00:000,0000-00-00 00:00:000,1,3,,1
2210,EL EDEN SORPRENDETE ,22.776735,-102.581118,32,0,115,"El Eden Zacatecas, Mex",No hay Infromación del destino,0000-00-00 00:00:000,0000-00-00 00:00:000,1,3,,1
2211,EL TELEFERICO ,22.766289,-102.580646,32,0,116,"Estacion 2, Lomas de La Soledad, 98040 Zacatecas ‎ Tel: 01 492 922 6013   ‎ ",No hay Infromación del destino,0000-00-00 00:00:000,0000-00-00 00:00:000,1,3,,1
2212,FERIA DE PRIMAVERA DE JEREZ,22.647284,-102.987927,32,0,95,"Jerez de Garcia Salinas, Zacatecas, Mex.",No hay Infromación del destino,0000-00-00 00:00:000,0000-00-00 00:00:000,1,3,,1
2213,JEREZADA ,22.647284,-102.987927,32,0,95,"Jerez de Garcia Salinas, Zacatecas, Mex.",No hay Infromación del destino,0000-00-00 00:00:000,0000-00-00 00:00:000,1,3,,1
2214,LA QUEMADA ,23.500207,-102.816632,32,0,111,"La Quemada, Zacatecas",No hay Infromación del destino,0000-00-00 00:00:000,0000-00-00 00:00:000,1,3,,1
2215,MUSEO DE LAS ROCAS Y MINERALES,22.776775,-102.581107,32,0,68,"Cerro del Grillo, La Mina 'El Edén' Zacatecas ‎Tel:01 492 922 3002",No hay Infromación del destino,0000-00-00 00:00:000,0000-00-00 00:00:000,1,3,,1
2216,SANTUARIO DE PLATEROS ,23.228904,-102.840768,32,0,116,"Hidalgo S/n, Poblado de Plateros, 99000 Fresnillo, Zacatecas ‎ Tel: 01 493 932 1763",No hay Infromación del destino,0000-00-00 00:00:000,0000-00-00 00:00:000,1,3,,1
2217,SIERRA DE ORGANOS SORPRENDENTE ,23.990017,-103.822403,32,0,97,Parque Nacional Sierra de Organos,No hay Infromación del destino,0000-00-00 00:00:000,0000-00-00 00:00:000,1,3,,1
2218,TIROLESA 840 SORPRENDENTE ,22.781879,-102.566907,32,0,120,"La Bufa 98000, Zacatecas",No hay Infromación del destino,0000-00-00 00:00:000,0000-00-00 00:00:000,1,3,,1
2219,ARCHIVO HSTORICO DEL DISTRITO FEDERAL,22.781879,-99.136164,9,0,68,"Donceles República de Chile 8, Centro, Cuauhtemoc, 06010 Ciudad de Mexico, Distrito Federal, Mexico ‎  Tel: +52 55 5510 8582  ",No hay Infromación del destino,0000-00-00 00:00:000,0000-00-00 00:00:000,1,3,,1
2220,CENTRO CULTURAL JOSE MARTI,19.43686,-99.146409,9,0,8,"Dr. Mora 1, Colonia Centro, Centro, 06050 Cuauhtemoc, Distrito Federal ‎  Tel:01 55 5521 2115   ‎",No hay Infromación del destino,0000-00-00 00:00:000,0000-00-00 00:00:000,1,3,,1
2221,CENTRO CULTURAL OLLIN YOLIZTLI,19.303053,-99.178434,9,0,8,"Anillo Periferico Sur 5141, Isidro Fabela, Tlalpan, 14030 Ciudad de Mexico, Distrito Federal ‎  Tel:01 55 5606 0016   ‎",No hay Infromación del destino,0000-00-00 00:00:000,0000-00-00 00:00:000,1,3,,1
2222,CENTRO CULTURAL XAVIER VILLAURRUTIA,19.423616,-99.163,9,0,8,Av. Insurgentes Centro (Glorieta del Metro Insurgentes) Col. Roma,No hay Infromación del destino,0000-00-00 00:00:000,0000-00-00 00:00:000,1,3,,1
2223,EL BAZAR DEL SABADO ARTISTICO ,19.344923,-99.192617,9,0,100,"Interior 12 y 13, San Jacinto 11, San Angel, alvaro Obregon, 01000 Ciudad de Mexico, Distrito Federal ‎ Tel:01 55 5616 0082  ",No hay Infromación del destino,0000-00-00 00:00:000,0000-00-00 00:00:000,1,3,,1
2224,MUSEO ARCHIVO DE FOTOGRAFIA ,19.435069,-99.132151,9,0,68,"República de Guatemala República de Guatemala 34, Centro, Cuauhtemoc, 06010 Ciudad de Mexico, Distrito Federal ‎  Tel: 01 55 2616 7057  ",No hay Infromación del destino,0000-00-00 00:00:000,0000-00-00 00:00:000,1,3,,1
2225,MUSEO DE LA CIUDAD DE MEXICO ,19.429356,-99.132516,9,0,68,"Jose Maria Pino Suarez 30, Centro, Cuauhtemoc, 06060 Ciudad de Mexico, Distrito Federal ‎  Tel: 01 55 5522 4775",No hay Infromación del destino,0000-00-00 00:00:000,0000-00-00 00:00:000,1,3,,1
2226,MUSEO DE LOS FERROCARRILEROS,19.48181,-99.117003,9,0,68,"Alberto Herrera S/N, Aragon la Villa, Gustavo A. Madero, 07000 Ciudad de Mexico, Distrito Federal ‎  Tel: 01 55 5118 6407",No hay Infromación del destino,0000-00-00 00:00:000,0000-00-00 00:00:000,1,3,,1
2227,MUSEO FRANZ MAYER,19.437249,-99.143281,9,0,68,"Hidalgo 45, Centro Historico, Cuauhtemoc, 06300 Ciudad de Mexico, Distrito Federal ‎ 01 55 5518 2266",No hay Infromación del destino,0000-00-00 00:00:000,0000-00-00 00:00:000,1,3,,1
2228,MUSEO FRIDA KAHLO,19.355177,-99.16247,9,0,68,"Londres 247, Del Carmen, Coyoacan, 04100 Ciudad de Mexico, D.F. ‎  Tel: 01 55 5554 5999",No hay Infromación del destino,0000-00-00 00:00:000,0000-00-00 00:00:000,1,3,,1
2229,MUSEO NACIONAL DE ARTE,19.436371,-99.139421,9,0,68,"Tacuba 8, Centro Historico, Cuauhtemoc, 06010 Ciudad de Mexico, D.F. ‎  774 m NO Tel: 01 55 5130 3400   ‎ ",No hay Infromación del destino,0000-00-00 00:00:000,0000-00-00 00:00:000,1,3,,1
2230,MUSEO NACIONAL DE CULTURAS POPULARES,19.350125,-99.160618,9,0,68,"Av. Hidalgo 289, Del Carmen, Coyoacan, 04100 Ciudad de Mexico, Distrito Federal ‎  Tel: 01 55 4155 0920",No hay Infromación del destino,0000-00-00 00:00:000,0000-00-00 00:00:000,1,3,,1
2231,MUSEO NACIONAL DE LA REVOLUCION ,19.436369,-99.153971,9,0,68,"De La República S/N, Tabacalera, Cuauhtemoc, 06030 Ciudad de Mexico, Distrito Federal ",No hay Infromación del destino,0000-00-00 00:00:000,0000-00-00 00:00:000,1,3,,1
2232,MUSEO PANTEON SAN FERNANDO ,19.439253,-99.148331,9,0,68,"San Fernando Plaza San Fernando 17, Guerrero, Cuauhtemoc, 06300 Ciudad de Mexico, Distrito Federal ‎  Tel: 01 55 5518 4736   ‎",No hay Infromación del destino,0000-00-00 00:00:000,0000-00-00 00:00:000,1,3,,1
2233,SALON DE CABILDOS ,19.436544,-99.137297,9,0,115,"Donceles 36, Centro Historico, Cuauhtemoc, 06010 Ciudad de Mexico, Distrito Federal ‎  Tel: 01 55 5510 2197",No hay Infromación del destino,0000-00-00 00:00:000,0000-00-00 00:00:000,1,3,,1
2234,ANGUS,19.432004,-99.151226,9,0,2,"Copenhagu 31, Cuauhtemoc, 06600 Distrito Federal ‎  01 55 5208 2828 ",No hay Infromación del destino,0000-00-00 00:00:000,0000-00-00 00:00:000,1,3,,1
2235,ANTIGUA HACIENDA DE TLALPAN ,19.280904,-99.165742,9,0,2,"Calz Tlalpan 4619, Tlalpan, 14000 Distrito Federal ‎  Tel: 01 55 5573 9933   ‎ ",No hay Infromación del destino,0000-00-00 00:00:000,0000-00-00 00:00:000,1,3,,1
2236,ARGENTINISIMO,19.407669,-99.17777,9,0,2,"Tamaulipas esquina con General Benajim Hill, Colonia Condesa",No hay Infromación del destino,0000-00-00 00:00:000,0000-00-00 00:00:000,1,3,,1
2237,ARROYO,19.28725,-99.175161,9,0,2,"Av de los Insurgentes Sur 4003, Tlalpan, 14000 Ciudad de Mexico, Distrito Federal ‎  Tel: 01 55 5573 4344   ‎  · ",No hay Infromación del destino,0000-00-00 00:00:000,0000-00-00 00:00:000,1,3,,1
2238,BARRIO SUR,19.34885,-99.198462,9,0,2,"Santa Catarina 207, Col.San angel Inn ltavista 5550-4427 / 5550-4716",No hay Infromación del destino,0000-00-00 00:00:000,0000-00-00 00:00:000,1,3,,1
2239,BAZAR DEL SABADO DELICIOSO ,19.344923,-99.192617,9,0,2,"Interior 12 y 13, San Jacinto 11, San Angel, alvaro Obregon, 01000 Ciudad de Mexico, Distrito Federal ‎ Tel:01 55 5616 0082",No hay Infromación del destino,0000-00-00 00:00:000,0000-00-00 00:00:000,1,3,,1
2240,EL BAJIO ,-99.1775,-99.1775,9,0,2,"Eje 3 Norte Av. Cuitlahuac 2709, Azcapotzalco, Ciudad de Mexico, Distrito Federal ‎  Tel:01 55 5234 3763   ‎",No hay Infromación del destino,0000-00-00 00:00:000,0000-00-00 00:00:000,1,3,,1
2241,LA CERVEZA DE BARRIO,19.432938,-99.183221,9,0,2,"Euler 145, Polanco, Miguel Hidalgo, 11550 Mexico City, Federal District ‎  Tel: 01 55 5280 5405   ‎",No hay Infromación del destino,0000-00-00 00:00:000,0000-00-00 00:00:000,1,3,,1
2242,LA FONDA DEL RECUERDO ,19.435251,-99.17386,9,0,2,"Bahia de las Palmas 37, Veronica Anzures, Miguel Hidalgo, 11300 Ciudad de Mexico, Distrito Federal ‎  Tel:01 55 9112 7476 ",No hay Infromación del destino,0000-00-00 00:00:000,0000-00-00 00:00:000,1,3,,1
2243,L'ENCANTO DE LOLA,19.345972,-99.190821,9,0,2,"Amargura 14, Col. San Angel, San ngel / Altavista, MX ‎  Tel:01 55 5550 8429   ‎ ",No hay Infromación del destino,0000-00-00 00:00:000,0000-00-00 00:00:000,1,3,,1
2244,LES MOUSTTACHES,19.429666,-99.165691,9,0,2,"Rio Sena 88, Cuauhtemoc, 06500 Ciudad de Mexico, Distrito Federal ‎  Tel: 01 55 5533 3390   ‎  · ",No hay Infromación del destino,0000-00-00 00:00:000,0000-00-00 00:00:000,1,3,,1
2245,NUEVE NUEVE BISTRO MEXICANO,19.418263,-99.159262,9,0,2,"alvaro Obregon 99, Roma Norte, Cuauhtemoc, 06700 Ciudad de Mexico, Distrito Federal ‎  Tel: 01 55 5525 9795",No hay Infromación del destino,0000-00-00 00:00:000,0000-00-00 00:00:000,1,3,,1
2246,PRIMOS ,19.411195,-99.179008,9,0,2,"Michoacan 168, Hipodromo Condesa, Cuauhtemoc, 06170 Ciudad de Mexico, Distrito Federal ‎  Tel: 01 55 5256 0950",No hay Infromación del destino,0000-00-00 00:00:000,0000-00-00 00:00:000,1,3,,1
2247,PUNTA ARENA,19.430213,-99.210774,9,0,2,"Paseo de Las Palmas 275, Lomas de Chapultepec, Miguel Hidalgo, 11000 Ciudad de Mexico‎  Tel: 01 55 5520 1723",No hay Infromación del destino,0000-00-00 00:00:000,0000-00-00 00:00:000,1,3,,1
2248,RESTAURANTE ADONIS ,19.435393,-99.18823,9,0,2,"Homero 424, Miguel Hidalgo, 11560 Distrito Federal ‎  Tel: 01 55 5203 8491   ‎ ",No hay Infromación del destino,0000-00-00 00:00:000,0000-00-00 00:00:000,1,3,,1
2249,BAZAR DEL SABADO DESCONOCIDO ,19.344923,-99.192617,9,0,100,"Interior 12 y 13, San Jacinto 11, San Angel, alvaro Obregon, 01000 Ciudad de Mexico, Distrito Federal ‎ Tel:01 55 5616 0082",No hay Infromación del destino,0000-00-00 00:00:000,0000-00-00 00:00:000,1,3,,1
2250,DIA DE LA INDEPENDENCIA DE MEXICO ,19.4326,-99.133226,9,0,95,"Zocalo, Plaza de la Constitucion Ciudad de Mexico",No hay Infromación del destino,0000-00-00 00:00:000,0000-00-00 00:00:000,1,3,,1
2251,SEMANA SANTA REPRESENTACION DE LA PASION DE CRISTO ,19.343612,-99.090002,9,0,95,"Parque Nacional Cerro de la Estrella, Iztapalapa, Ciudad de Mexico, D.F. ‎  ",No hay Infromación del destino,0000-00-00 00:00:000,0000-00-00 00:00:000,1,3,,1
2252,CALLE REGINA ,19.413254,-99.065548,9,0,100,"Pantitlan, Iztacalco, 08100 Ciudad de Mexico, D.F.",No hay Infromación del destino,0000-00-00 00:00:000,0000-00-00 00:00:000,1,3,,1
2253,EL HIJO DEL CUERVO ,19.349771,-99.163918,9,0,12,"Jardin centenario 17, Del Carmen, Coyoacan, 04000 Ciudad de Mexico, Distrito Federal ‎  Tel: 01 55 5658 5306   ‎",No hay Infromación del destino,0000-00-00 00:00:000,0000-00-00 00:00:000,1,3,,1
2254,HIPODROMO DE LAS AMERICAS ,19.438388,-99.222575,9,0,125,"Av Industria Militar S/N, Residencial Militar, Miguel Hidalgo, 11600 Ciudad de Mexico, Distrito Federal ‎ Tel:01 55 5387 0600",No hay Infromación del destino,0000-00-00 00:00:000,0000-00-00 00:00:000,1,3,,1
2255,KIDZANIA ,19.361539,-99.273366,9,0,126,"Vasco de Quiroga 3800, Local 1, Santa Fe, alvaro Obregon, 05109 Ciudad de Mexico, Distrito Federal ‎  Tel: 01 55 9177 4700  ",No hay Infromación del destino,0000-00-00 00:00:000,0000-00-00 00:00:000,1,3,,1
2256,LA FERIA DE CHAPULTEPEC,19.416108,-99.195667,9,0,6,"Circuito Bosque de Chapultepec S/n, Segunda Seccion, Miguel Hidalgo, 11560 Ciudad de Mexico, Distrito Federal ",No hay Infromación del destino,0000-00-00 00:00:000,0000-00-00 00:00:000,1,3,,1
2257,LAS DUELISTAS ,19.430091,-99.142772,9,0,120,"Aranda, Centro, Cuauhtemoc, 06000 Ciudad de Mexico, Distrito Federal ‎ ",No hay Infromación del destino,0000-00-00 00:00:000,0000-00-00 00:00:000,1,3,,1
2258,LUCHA LIBRE,19.424466,-99.152004,9,0,126,"Doctor Lavista 189, Doctores, Cuauhtemoc, 06720 Ciudad de Mexico, Distrito Federal ‎  Tel: 01 55 5588 2995  ",No hay Infromación del destino,0000-00-00 00:00:000,0000-00-00 00:00:000,1,3,,1
2259,SIX FLAGS,19.295469,-99.210731,9,0,6,"Carretera Picacho al Ajusco Km. 1.5, Heroes de Padierna, Tlalpan, 14200 Ciudad de Mexico,  Tel: 01 55 5339 3600 ",No hay Infromación del destino,0000-00-00 00:00:000,0000-00-00 00:00:000,1,3,,1
2260,ZOOLOGICO DE CHAPULTEPEC,19.423191,-99.189573,9,0,94,"Calle Chivatito, Int. de la 1ra seccion del Bosque de Chapultepec S/n, San Miguel Chapultepec, Miguel Hidalgo, 11850 Ciudad de Mexico‎  01 55 5553 6263",No hay Infromación del destino,0000-00-00 00:00:000,0000-00-00 00:00:000,1,3,,1
2261,INSURGENTES ,19.354473,-99.185175,9,0,115,"Av. De los insurgentes, Ciudad de Mexico",No hay Infromación del destino,0000-00-00 00:00:000,0000-00-00 00:00:000,1,3,,1
2262,ZONA ROSA,19.425799,-99.164151,9,0,12,"Zona Rosa, Cuauhtemoc, Ciudad de Mexico",No hay Infromación del destino,0000-00-00 00:00:000,0000-00-00 00:00:000,1,3,,1
2263,BOSQUE DE CHAPULTEPEC,19.419457,-99.189475,9,0,71,"Av Paseo de la Reforma SN, Bosque de Chapultepec I, Miguel Hidalgo, 11850 Ciudad de Mexico, Distrito Federal ‎  Tel: 01 55 5212 2171  ",No hay Infromación del destino,0000-00-00 00:00:000,0000-00-00 00:00:000,1,3,,1
2264,XOCHIMILCO ECOLOGICO,19.257268,-99.102952,9,0,97,"Xochimilco, Ciudad de Mexico",No hay Infromación del destino,0000-00-00 00:00:000,0000-00-00 00:00:000,1,3,,1
2265,ZOOLOGICO DE CHAPULTEPEC ECOLOGICO ,19.423191,-99.189573,9,0,94,"Calle Chivatito, Int. de la 1ra seccion del Bosque de Chapultepec S/n, San Miguel Chapultepec, Miguel Hidalgo, 11850 Ciudad de Mexico‎  01 55 5553 6263",No hay Infromación del destino,0000-00-00 00:00:000,0000-00-00 00:00:000,1,3,,1
2266,DRAGON GOTCHA AJUSCO ,19.258646,-99.243732,9,0,120,"Carr Panoramica Picacho-Ajusco Km11.2, km11.2, Tlalpan, Ciudad de Mexico, D.F. ‎  Tel: 01 55 5658 1397",No hay Infromación del destino,0000-00-00 00:00:000,0000-00-00 00:00:000,1,3,,1
2267,TODO GOTCHA,19.339269,-99.292182,9,0,120,"Valle de Las Monjas, San Mateo Tlaltenango, Cuajimalpa de Morelos, 05600 Ciudad de Mexico, Distrito Federal ‎  Tel: 01 55 5812 7672   ‎ ",No hay Infromación del destino,0000-00-00 00:00:000,0000-00-00 00:00:000,1,3,,1
